{
  "schemaVersion": "1.0.0",
  "framework": "Genesis Human Trust Validation",
  "project": {
    "name": "Acing IU: Genesis",
    "repository": "AcingTime420/Acing-IU-Genesis",
    "governancePrincipal": {
      "github": "AcingTime420",
      "scope": "repository-and-project-governance",
      "legalOwnershipClaim": "not-established-by-this-file"
    }
  },
  "alignmentDisclaimer": "External standards and frameworks are alignment references only. They do not establish certification, conformance, regulatory compliance, or third-party endorsement.",
  "principles": [
    "People remain the final authority for protected actions.",
    "Capability does not create authority.",
    "Claims follow current evidence.",
    "Simulation stays visibly simulated.",
    "Security and privacy controls fail closed where authority is uncertain.",
    "Consequential actions must be attributable and auditable.",
    "Understanding Genesis and its trust status must not depend on technical expertise or payment."
  ],
  "maturityLabels": {
    "Verified": "Current implementation plus reproducible evidence demonstrates the complete claim within its stated scope.",
    "Tested": "Relevant implementation and automated validation exist, but the broader end-to-end claim is not fully verified.",
    "Implemented": "The control or governance rule exists, but current automated evidence does not prove the complete public claim.",
    "Target": "Required architecture or behavior is defined but not sufficiently implemented and evidenced.",
    "Not available": "The capability is intentionally unavailable until its required safety and evidence gates pass."
  },
  "externalAlignments": [
    {
      "id": "NIST-AI-RMF",
      "title": "NIST AI Risk Management Framework",
      "reference": "https://www.nist.gov/itl/ai-risk-management-framework",
      "scope": "risk management, trustworthiness, governance, measurement and management"
    },
    {
      "id": "NIST-AI-600-1",
      "title": "NIST AI RMF Generative AI Profile",
      "reference": "https://www.nist.gov/publications/artificial-intelligence-risk-management-framework-generative-artificial-intelligence",
      "scope": "generative-AI risk identification and lifecycle risk management"
    },
    {
      "id": "NIST-NCCOE-AGENT-IAM-2026",
      "title": "NCCoE Software and AI Agent Identity and Authorization",
      "reference": "https://www.nccoe.nist.gov/projects/software-and-ai-agent-identity-and-authorization",
      "scope": "agent identification, authentication, authorization, auditing, non-repudiation and prompt-injection risk"
    },
    {
      "id": "NIST-TEVV-ATHLON",
      "title": "NIST TEVV-Athlon Framework for Evaluating AI Systems",
      "reference": "https://www.nist.gov/artificial-intelligence/ai-research/tevv-athlon-framework-evaluating-ai-systems",
      "scope": "test, evaluation, verification and validation for AI systems including agentic systems"
    },
    {
      "id": "W3C-WEBAUTHN-L3",
      "title": "W3C Web Authentication Level 3",
      "reference": "https://www.w3.org/TR/2026/REC-webauthn-3-20260825/",
      "scope": "strong public-key authentication, user consent and user verification"
    },
    {
      "id": "OWASP-LLM-TOP10-2025",
      "title": "OWASP Top 10 for LLM and Generative AI Applications 2025",
      "reference": "https://genai.owasp.org/resource/owasp-top-10-for-llm-applications-2025/",
      "scope": "prompt injection, sensitive information disclosure, excessive agency, misinformation and related application risks"
    },
    {
      "id": "C2PA",
      "title": "C2PA Content Credentials Specifications",
      "reference": "https://spec.c2pa.org/specifications/",
      "scope": "digital-content source and provenance"
    }
  ],
  "questions": [
    {
      "id": "HTQ-001",
      "question": "Who is ultimately in control: the human or Genesis?",
      "plainLanguageAnswer": "For protected actions, the human is the final project authority. Genesis may analyze, recommend and prepare actions, but it may not create its own permission.",
      "status": "Implemented",
      "currentTruth": "Owner Law and the Genesis Constitution establish human sovereignty. Cryptographic L5 enforcement is still a Target.",
      "peopleImpact": "A person must not lose authority merely because an AI is technically capable of acting.",
      "risk": "Unchecked autonomy can turn model capability into unauthorized real-world action.",
      "controls": [
        "docs/governance/OWNER_LAW.md",
        "docs/governance/GENESIS_CONSTITUTION.md",
        ".github/agents/genesis.agent.md",
        "config/genesis/owner-law.json"
      ],
      "evidencePaths": [
        "docs/governance/OWNER_LAW.md",
        "config/genesis/owner-law.json"
      ],
      "validationPaths": [
        "scripts/check-genesis-governance.py",
        ".github/workflows/genesis-self-governance.yml"
      ],
      "externalAlignmentIds": [
        "NIST-AI-RMF",
        "NIST-NCCOE-AGENT-IAM-2026"
      ],
      "completionCondition": "A trusted runtime independently verifies protected-action authorization and denies execution when valid human proof is absent.",
      "nonClaims": [
        "Genesis does not yet claim cryptographically enforced L5 Human Sovereignty at runtime."
      ]
    },
    {
      "id": "HTQ-002",
      "question": "Can Genesis give itself more power?",
      "plainLanguageAnswer": "Genesis is governed by a no-self-escalation rule: it cannot legitimately grant itself permissions, credentials, roles, policy exceptions or trusted-device status.",
      "status": "Implemented",
      "currentTruth": "The rule is encoded in Owner Law, agent instructions and machine-readable governance. Runtime enforcement across every future tool boundary remains to be proven.",
      "peopleImpact": "AI authority should not expand just because the AI requests it.",
      "risk": "Self-escalation can bypass human intent and least-privilege boundaries.",
      "controls": [
        "docs/governance/OWNER_LAW.md",
        ".github/agents/genesis.agent.md",
        "config/genesis/owner-law.json"
      ],
      "evidencePaths": [
        "config/genesis/owner-law.json"
      ],
      "validationPaths": [
        "scripts/check-genesis-governance.py"
      ],
      "externalAlignmentIds": [
        "NIST-NCCOE-AGENT-IAM-2026",
        "OWASP-LLM-TOP10-2025"
      ],
      "completionCondition": "Every operational tool and delegated-agent path enforces non-amplifying authority and has negative tests for self-escalation.",
      "nonClaims": [
        "Policy text alone is not proof that every future integration is enforcement-safe."
      ]
    },
    {
      "id": "HTQ-003",
      "question": "Can Genesis perform a high-risk action without me knowing or approving it?",
      "plainLanguageAnswer": "The intended answer is no. L5 actions are designed to require a fresh, action-bound human authorization before execution.",
      "status": "Target",
      "currentTruth": "Authorization request and receipt contracts exist, but the trusted WebAuthn and device-bound verifier is not implemented.",
      "peopleImpact": "People should see and approve consequential actions before they happen.",
      "risk": "Broad or reusable consent can be transformed into authority for a different or more dangerous action.",
      "controls": [
        "schemas/genesis-human-authorization-request.schema.json",
        "schemas/genesis-human-authorization-receipt.schema.json",
        "scripts/genesis-create-authorization-request.py"
      ],
      "evidencePaths": [
        "schemas/genesis-human-authorization-request.schema.json",
        "schemas/genesis-human-authorization-receipt.schema.json"
      ],
      "validationPaths": [
        "scripts/check-genesis-governance.py"
      ],
      "externalAlignmentIds": [
        "W3C-WEBAUTHN-L3",
        "NIST-NCCOE-AGENT-IAM-2026"
      ],
      "completionCondition": "WebAuthn user verification plus a recognized device-bound approval key is verified against the exact action digest, nonce and expiry before L5 execution.",
      "nonClaims": [
        "A chat message, checkbox, JSON field or AI statement is not valid L5 approval."
      ]
    },
    {
      "id": "HTQ-004",
      "question": "Can I stop Genesis or revoke its authority?",
      "plainLanguageAnswer": "Genesis is designed so a human can revoke delegated authority and protected operations fail closed when required authorization is unavailable.",
      "status": "Target",
      "currentTruth": "Revocation is constitutional law and part of the authorization design; a complete runtime revocation service is not yet evidenced.",
      "peopleImpact": "Consent that cannot be withdrawn is not meaningful control.",
      "risk": "Persistent credentials or standing authority can outlive the person's intent.",
      "controls": [
        "docs/governance/OWNER_LAW.md",
        "docs/governance/GENESIS_CONSTITUTION.md",
        "config/genesis/owner-law.json"
      ],
      "evidencePaths": [
        "docs/governance/OWNER_LAW.md"
      ],
      "validationPaths": [
        "scripts/check-genesis-governance.py"
      ],
      "externalAlignmentIds": [
        "NIST-NCCOE-AGENT-IAM-2026",
        "NIST-AI-RMF"
      ],
      "completionCondition": "Revocation, expiry, verifier-unavailable and emergency-stop tests all prove protected actions are denied after authority is withdrawn.",
      "nonClaims": [
        "Runtime revocation is not yet Verified."
      ]
    },
    {
      "id": "HTQ-005",
      "question": "How do I know Genesis is not exaggerating what it can do?",
      "plainLanguageAnswer": "Genesis uses explicit maturity labels and requires claims to follow evidence. Planned, simulated and unavailable capabilities must not be presented as verified.",
      "status": "Tested",